{
  "schema_version": "test-provenance-v1",
  "ticket_id": "TICKET-CLOUDFLARE-KV-BINDING-20260903",
  "sequence": 1,
  "provenance_status": "VERIFIED",
  "baseline_parent": "b58bf18341a5c8808a7cc02cd4e6aaa30f359ef5",
  "test_files": [
    {
      "path": "tests/test_cloudflare_kv_binding.py",
      "sha256": "4b70937e721885b5af5fc985acaa6252c12707d9efa1f334b87fd23b569bf4ab"
    }
  ],
  "red_tests": [
    {
      "command": [
        "python3",
        "-m",
        "pytest",
        "-q",
        "tests/test_cloudflare_kv_binding.py"
      ],
      "expected_exit": 1,
      "failure_fingerprint": "KV_BINDING_MISSING: [[kv_namespaces]] binding not found in wrangler.toml"
    }
  ],
  "allowed_source_paths": [
    "wrangler.toml"
  ],
  "test_owner_role": "qa_tester",
  "reviewer_role": "code_reviewer",
  "supersedes": null,
  "correction_reason": null,
  "rationale": "Add KV namespace binding to wrangler.toml for Cloudflare Worker cache"
}
