{
  "schema_version": "test-provenance-v1",
  "ticket_id": "TICKET-HLITE-008",
  "sequence": 1,
  "provenance_status": "VERIFIED",
  "baseline_parent": "32ad5580b6438b1660188b2018d96d669f34d180",
  "test_files": [
    {
      "path": "tests/test_horo_lite_unified_reading.py",
      "sha256": "f76bf51bb211e7e349e39cd18089c208d8a2238b28fd900c76c7e1fca2a93431"
    }
  ],
  "red_tests": [
    {
      "command": [
        "python3",
        "-m",
        "pytest",
        "tests/test_horo_lite_unified_reading.py",
        "-k",
        "test_export_formats_and_privacy_default",
        "-v"
      ],
      "expected_exit": 1,
      "failure_fingerprint": "EXPORT_ENGINE_MISSING_FUNCTION_* or EXPORT_ENGINE_NAMESPACE_MISSING_FUNCTION_* or EXPORT_ENGINE_INVALID_CANVAS_WIDTH or EXPORT_ENGINE_INVALID_STORY_HEIGHT or EXPORT_ENGINE_STORY_DIMENSIONS_NOT_WIRED or EXPORT_ENGINE_PRIVACY_MASKING_TOKEN_MISSING or EXPORT_ENGINE_PRIVACY_COPY_TEXT_NOT_ENFORCED or EXPORT_ENGINE_PRIVACY_DEFAULT_NOT_PUSHED or EXPORT_ENGINE_FUNCTION_MISSING_INCLUDE_BIRTH_OPTION_* or EXPORT_ENGINE_NAMESPACE_MISSING"
    }
  ],
  "allowed_source_paths": [
    "public/export_engine.js",
    "public/export_modal.css",
    "public/export_modal.html",
    "public/lite.js"
  ],
  "test_owner_role": "qa_tester",
  "reviewer_role": "code_reviewer",
  "supersedes": "32ad5580b6438b1660188b2018d96d669f34d180",
  "correction_reason": "Phase H QA baseline supersedes Phase G calibration baseline; Phase H adds multi-format export and privacy default contract tests.",
  "rationale": "Record verified test provenance baseline for Horo Lite Phase H (TICKET-HLITE-008 / TICKET-HLITE-008-QA) Multi-Format Mobile Infographic Exporter Suite contract verification in tests/test_horo_lite_unified_reading.py: Static-analysis audit of public/export_engine.js verifies all 4 export functions exist and are declared/callable (exportFullPng, exportStoryPng, copySocialSummary, printResult); window.horoLiteExport namespace object exports all 4 functions; story canvas dimensions strictly enforce CANVAS_WIDTH = 1080 and STORY_HEIGHT = 1920 (exact 9:16 aspect ratio: 1080x1920); exportStoryPng explicitly creates canvas using CANVAS_WIDTH and STORY_HEIGHT; privacy masking token DEFAULT_COPY_TEXT = '\\u0e02\\u0e49\\u0e2d\\u0e21\\u0e39\\u0e25\\u0e27\\u0e31\\u0e19/\\u0e40\\u0e27\\u0e25\\u0e32\\u0e40\\u0e01\\u0e34\\u0e14\\u0e0b\\u0e48\\u0e2d\\u0e19\\u0e40\\u0e1e\\u0e37\\u0e48\\u0e2d\\u0e04\\u0e27\\u0e32\\u0e21\\u0e40\\u0e1b\\u0e47\\u0e19\\u0e2a\\u0e48\\u0e27\\u0e19\\u0e15\\u0e31\\u0e27' is defined and pushed in gatherExportText by default; options.includeBirthDetails is supported across all 4 export functions. Negative control matrix confirms fail-closed rejection when any export function is missing, when any function is omitted from window.horoLiteExport namespace, when canvas width or story height is altered, when story canvas creation is unwired, when DEFAULT_COPY_TEXT is missing or altered, when default push is bypassed, when includeBirthDetails option handling is stripped, and when namespace object is omitted. Full test suite verification: 18/18 PASS (100% pass rate), zero regressions."
}
