{
  "schema_version": "test-provenance-v1",
  "ticket_id": "TICKET-PROD-503-001",
  "sequence": 7,
  "provenance_status": "VERIFIED",
  "baseline_parent": "a694f8a76b5b89b46e2eb3b99e9be5f6064ad01c",
  "test_files": [
    {
      "path": "tests/vercel_preview_policy.test.mjs",
      "sha256": "2d7e886fa709341db3d5c43ec4405c6489fa1e65aeaabba9d2a5692098b59008"
    }
  ],
  "red_tests": [
    {
      "command": [
        "node",
        "--test",
        "tests/vercel_preview_policy.test.mjs"
      ],
      "expected_exit": 1,
      "failure_fingerprint": "1 failed; Vercel Git auto-deployment policy was absent, so non-main branches continued creating unused Preview deployments"
    }
  ],
  "allowed_source_paths": [
    "vercel.json",
    "PROJECT_TASKS.md",
    "plans/plan.md"
  ],
  "test_owner_role": "qa_tester",
  "reviewer_role": "code_reviewer",
  "supersedes": null,
  "correction_reason": null,
  "rationale": "Retire unused Vercel Preview deployments without disabling automatic production deployment from the main branch."
}
