{
  "schema_version": "test-provenance-v1",
  "ticket_id": "TICKET-KAN-297-GITLEAKS-IN-CI-INTEGRATION",
  "sequence": 1,
  "provenance_status": "VERIFIED",
  "baseline_parent": "80b4fbfdf9f89fcba2f08845c9a78aa6ca7b8639",
  "test_files": [
    {
      "path": "tests/test_gitleaks_in_ci_contract.py",
      "sha256": "d4b9099572d1b6255ce75f4d7ec54b4a76a1c26e08ac6be4514968704727a134"
    }
  ],
  "red_tests": [
    {
      "command": [
        "pytest",
        "tests/test_gitleaks_in_ci_contract.py"
      ],
      "expected_exit": 1,
      "failure_fingerprint": "test_lint_and_security_runs_gitleaks: gitleaks action not found in lint-and-security steps; test_gitleaks_uses_github_token: gitleaks step not found"
    }
  ],
  "allowed_source_paths": [
    ".github/workflows/ci.yml"
  ],
  "test_owner_role": "qa_tester",
  "reviewer_role": "code_reviewer",
  "supersedes": null,
  "correction_reason": null,
  "rationale": "M7 of Phase 0 Foundation Hardening (KAN-290, Epic KAN-289). Red Team CRITICAL-7: no secret scanning in CI pipeline. RED: lint-and-security job lacks gitleaks step (2/4 tests fail). GREEN: add gitleaks/gitleaks-action@ff98106e... (# v2.4.0) with GITHUB_TOKEN env to lint-and-security. No 'if' guard \u2014 runs on all tiers."
}
