{
  "schema_version": "test-provenance-v1",
  "ticket_id": "TICKET-KAN-291",
  "sequence": 3,
  "provenance_status": "VERIFIED",
  "baseline_parent": "43159f66d12ed256108fb2a4c016dd5727e10eb8",
  "test_files": [
    {
      "path": "tests/test_workflow_timeouts_contract.py",
      "sha256": "e61e58dbfa06a5c3cf0e64a2c736e71110505058cf2263d1fb63754da2ca735f"
    }
  ],
  "red_tests": [
    {
      "command": ["python3", "-m", "pytest", "tests/test_workflow_timeouts_contract.py"],
      "expected_exit": 1,
      "failure_fingerprint": "assert timeout-minutes exists on all CI jobs"
    }
  ],
  "allowed_source_paths": [
    ".github/workflows/ci.yml",
    ".github/workflows/test_provenance.yml",
    "tests/test_workflow_timeouts_contract.py"
  ],
  "test_owner_role": "qa_tester",
  "reviewer_role": "code_reviewer",
  "supersedes": null,
  "correction_reason": null,
  "rationale": "Add timeout-minutes to all CI jobs to prevent stuck workflows"
}